{
  "next_cursor": null,
  "provider": "crossref",
  "query": "perovskite HTL",
  "query_id": "query-1",
  "records": [
    {
      "doi": "10.1234/example",
      "title": "Fixture paper"
    }
  ],
  "response_sha256": "aaaaaaaaaaaaaaaaaaaaaaaaaaaaaaaaaaaaaaaaaaaaaaaaaaaaaaaaaaaaaaaa",
  "retrieved_at": "2026-07-11T00:00:00+00:00",
  "schema_version": "v13.literature_search_results.v1"
}
